{
  "dataset": "d365-finops-pqu",
  "schema_version": "1.1.0",
  "generated_at": "2026-10-15T04:35:05.363122Z",
  "source_key": "service_updates",
  "state": "stale",
  "source": {
    "publisher": "Microsoft",
    "repository": "MicrosoftDocs/dynamics-365-unified-operations-public",
    "branch": "main",
    "file_path": "articles/fin-ops-core/dev-itpro/get-started/public-preview-releases.md",
    "commit": "b348d48184186e3244de6aae50a1377c5718789f",
    "article_url": "https://learn.microsoft.com/en-us/dynamics365/fin-ops-core/dev-itpro/get-started/public-preview-releases",
    "raw_url": "https://raw.githubusercontent.com/MicrosoftDocs/dynamics-365-unified-operations-public/b348d48184186e3244de6aae50a1377c5718789f/articles/fin-ops-core/dev-itpro/get-started/public-preview-releases.md",
    "markdown_date": "2026-06-04",
    "sha256": "05421f92e451cdc1c8d3a46d908b9af7c0727ffba398a10b8067706c12af5ed6",
    "retrieved_at": "2026-10-08T19:14:10.623818Z"
  },
  "count": 9,
  "records": [
    {
      "version": "10.0.45",
      "release_label": "CY25Q4",
      "is_major": true,
      "preview_date": "2025-07-28",
      "preview_latest_update_date": "2025-08-08",
      "general_availability_date": "2025-09-12",
      "first_autoupdate_date": "2025-10-03",
      "second_autoupdate_date": "2025-10-31",
      "end_of_service_date": "2026-05-22"
    },
    {
      "version": "10.0.46",
      "release_label": "CY26Q1",
      "is_major": false,
      "preview_date": "2025-10-24",
      "preview_latest_update_date": "2025-11-17",
      "general_availability_date": "2025-12-26",
      "first_autoupdate_date": "2026-02-01",
      "second_autoupdate_date": "2026-03-01",
      "end_of_service_date": "2026-08-21"
    },
    {
      "version": "10.0.47",
      "release_label": "CY26Q2",
      "is_major": true,
      "preview_date": "2026-01-26",
      "preview_latest_update_date": "2026-02-16",
      "general_availability_date": "2026-03-13",
      "first_autoupdate_date": "2026-04-03",
      "second_autoupdate_date": "2026-05-01",
      "end_of_service_date": "2026-11-20"
    },
    {
      "version": "10.0.48",
      "release_label": "CY26Q3",
      "is_major": false,
      "preview_date": "2026-04-24",
      "preview_latest_update_date": "2026-05-11",
      "general_availability_date": "2026-06-05",
      "first_autoupdate_date": "2026-07-03",
      "second_autoupdate_date": "2026-07-31",
      "end_of_service_date": "2027-02-16"
    },
    {
      "version": "10.0.49",
      "release_label": "CY26Q4",
      "is_major": true,
      "preview_date": "2026-07-27",
      "preview_latest_update_date": "2026-08-17",
      "general_availability_date": "2026-09-11",
      "first_autoupdate_date": "2026-10-02",
      "second_autoupdate_date": "2026-10-30",
      "end_of_service_date": "2027-05-21"
    },
    {
      "version": "10.0.50",
      "release_label": "CY27Q1",
      "is_major": false,
      "preview_date": "2026-10-23",
      "preview_latest_update_date": "2026-11-17",
      "general_availability_date": "2026-12-22",
      "first_autoupdate_date": "2027-01-31",
      "second_autoupdate_date": "2027-02-28",
      "end_of_service_date": "2027-08-20"
    },
    {
      "version": "10.0.51",
      "release_label": "CY27Q2",
      "is_major": true,
      "preview_date": "2027-01-25",
      "preview_latest_update_date": "2027-02-15",
      "general_availability_date": "2027-03-12",
      "first_autoupdate_date": "2027-04-02",
      "second_autoupdate_date": "2027-04-30",
      "end_of_service_date": "2027-11-19"
    },
    {
      "version": "10.0.52",
      "release_label": "CY27Q3",
      "is_major": false,
      "preview_date": "2027-04-23",
      "preview_latest_update_date": "2027-05-10",
      "general_availability_date": "2027-06-04",
      "first_autoupdate_date": "2027-07-02",
      "second_autoupdate_date": "2027-07-30",
      "end_of_service_date": "2028-02-15"
    },
    {
      "version": "10.0.53",
      "release_label": "CY27Q4",
      "is_major": false,
      "preview_date": "2027-07-26",
      "preview_latest_update_date": "2027-08-16",
      "general_availability_date": "2027-09-10",
      "first_autoupdate_date": "2027-10-01",
      "second_autoupdate_date": "2027-10-29",
      "end_of_service_date": "2028-05-20"
    }
  ]
}
